{
  "all_controls_pass": true,
  "claim_boundary": "claim-context ledger for source-role explanation; not empirical evidence, not a physical qFEP realization, and not a clinical, neural, awakening, or practice-efficacy claim",
  "claim_count": 15,
  "controls": {
    "all_allowed_interpretations_present": true,
    "all_artifacts_exist": true,
    "all_figure_bindings_present": true,
    "all_future_evidence_boundaries_present": true,
    "all_gates_declared": true,
    "all_manuscript_sections_present": true,
    "all_prohibited_interpretations_present": true,
    "all_public_claims_represented": true,
    "all_reader_claims_present": true,
    "all_role_compatibility_rules_pass": true,
    "all_source_keys_resolve": true,
    "all_source_roles_present": true,
    "no_proxy_or_safety_reader_overclaims": true
  },
  "missing_allowed_interpretations": [],
  "missing_artifacts": [],
  "missing_figure_bindings": [],
  "missing_future_evidence": [],
  "missing_gates": [],
  "missing_manuscript_sections": [],
  "missing_prohibited_interpretations": [],
  "missing_reader_claims": [],
  "missing_source_roles": [],
  "proxy_overclaiming_reader_claims": [],
  "role_compatibility_failures": [],
  "rows": [
    {
      "allowed_interpretation": "Allowed only as local private artifact package only, not public independent reproduction: The local artifact bundle is hashed, schema-registered, and command-accounted for private release-readiness review.",
      "artifact": "output/data/artifact_release_manifest.json",
      "artifact_exists": true,
      "claim_id": "artifact_release_readiness",
      "evidence_ceiling": "local private artifact package only, not public independent reproduction",
      "evidence_class": "implementation_boundary",
      "figure_bindings": [
        "claim_context_evidence_ladder"
      ],
      "future_evidence_required": "Explicit publication approval, public archive deposition, independent or blinded reproduction, and external reviewer execution before any public-release or independent-reproduction claim.",
      "manuscript_sections": [
        "sec:discussion-source-role-boundaries",
        "sec:supplement-reproducibility-gates"
      ],
      "paper_locator": "Software artifact release package",
      "prohibited_inference": "Do not read local hashes, manifests, or validation commands as a public archive release, independent reproduction, empirical validation, or publication.",
      "reader_claim": "The local artifact bundle is hashed, schema-registered, and command-accounted for private release-readiness review.",
      "role_compatibility": {
        "ok": true,
        "rationale": "Local release-readiness claims need artifact, reproducibility, workflow, or validation support.",
        "rule": "release_readiness_requires_artifact_or_workflow_source"
      },
      "source_keys": [
        "cook2006validation",
        "gelman2020bayesianworkflow",
        "modrak2025calibration",
        "pineau2020reproducibility",
        "sailynoja2026posterior",
        "talts2018sbc"
      ],
      "source_role_count": 6,
      "source_roles": [
        {
          "citation_key": "cook2006validation",
          "evidence_status": "methodological_background",
          "role": "Bayesian software validation method and model-adequacy boundary",
          "source_id": "posterior_quantile_validation"
        },
        {
          "citation_key": "gelman2020bayesianworkflow",
          "evidence_status": "methodological_background",
          "role": "Bayesian workflow, model checking, and validation boundary background",
          "source_id": "gelman_bayesian_workflow"
        },
        {
          "citation_key": "modrak2025calibration",
          "evidence_status": "methodological_background",
          "role": "Bayesian calibration test-quantity sensitivity and undetected-error method boundary",
          "source_id": "calibration_test_quantity_sensitivity"
        },
        {
          "citation_key": "pineau2020reproducibility",
          "evidence_status": "methodological_background",
          "role": "artifact release and reproducibility checklist practice background",
          "source_id": "pineau_reproducibility_checklist"
        },
        {
          "citation_key": "sailynoja2026posterior",
          "evidence_status": "methodological_background",
          "role": "conditional posterior calibration method and dataset-specific computation boundary",
          "source_id": "posterior_conditional_calibration"
        },
        {
          "citation_key": "talts2018sbc",
          "evidence_status": "methodological_background",
          "role": "Bayesian workflow validation and simulation-based calibration background",
          "source_id": "talts_simulation_based_calibration"
        }
      ],
      "stressors": [
        "empirical_gap",
        "source_role_boundary"
      ],
      "support_count": 6,
      "validation_gate": "artifact_release_manifest_ok"
    },
    {
      "allowed_interpretation": "Allowed only as deterministic parameter sweep, not empirical practice evidence: When accuracy no longer depends on the separation prior, BMR favors the reduced model.",
      "artifact": "output/data/bmr_sweep.json",
      "artifact_exists": true,
      "claim_id": "bmr_prunes_sigma",
      "evidence_ceiling": "deterministic parameter sweep, not empirical practice evidence",
      "evidence_class": "finite_sweep",
      "figure_bindings": [
        "bmr_pruning_phase_diagram",
        "evidence_ceiling_stress_matrix",
        "claim_context_evidence_ladder"
      ],
      "future_evidence_required": "Pre-registered empirical or agent-benchmark evidence linking reduced complexity to task performance and subjective reports.",
      "manuscript_sections": [
        "sec:discussion-evidence-ceilings",
        "sec:methods-bmr-separation-prior",
        "sec:results-bmr-sensitivity"
      ],
      "paper_locator": "Equation 12 and Section 4.3",
      "prohibited_inference": "Do not read pruning in the sweep as evidence that meditation or realization removes self-models in people.",
      "reader_claim": "When accuracy no longer depends on the separation prior, BMR favors the reduced model.",
      "role_compatibility": {
        "ok": true,
        "rationale": "Finite model claims need formal, active-inference, or BMR support.",
        "rule": "model_claim_requires_formal_or_active_inference_source"
      },
      "source_keys": [
        "cook2006validation",
        "efron1979bootstrap",
        "friston2011posthoc",
        "friston2018bmr",
        "gelman2020bayesianworkflow",
        "gneiting2007scoring",
        "modrak2025calibration",
        "morris2019simulation",
        "parr2022active",
        "sailynoja2026posterior",
        "sandvedsmith2026noself",
        "talts2018sbc"
      ],
      "source_role_count": 12,
      "source_roles": [
        {
          "citation_key": "cook2006validation",
          "evidence_status": "methodological_background",
          "role": "Bayesian software validation method and model-adequacy boundary",
          "source_id": "posterior_quantile_validation"
        },
        {
          "citation_key": "efron1979bootstrap",
          "evidence_status": "methodological_background",
          "role": "bootstrap interval background for finite simulation robustness audits",
          "source_id": "bootstrap_uncertainty"
        },
        {
          "citation_key": "friston2011posthoc",
          "evidence_status": "methodological_background",
          "role": "Bayesian model-reduction background",
          "source_id": "bmr_posthoc_selection"
        },
        {
          "citation_key": "friston2018bmr",
          "evidence_status": "methodological_background",
          "role": "Bayesian model reduction free-energy comparison foundation",
          "source_id": "friston_bayesian_model_reduction"
        },
        {
          "citation_key": "gelman2020bayesianworkflow",
          "evidence_status": "methodological_background",
          "role": "Bayesian workflow, model checking, and validation boundary background",
          "source_id": "gelman_bayesian_workflow"
        },
        {
          "citation_key": "gneiting2007scoring",
          "evidence_status": "methodological_background",
          "role": "proper scoring-rule and probabilistic prediction evaluation method boundary",
          "source_id": "proper_scoring_rules"
        },
        {
          "citation_key": "modrak2025calibration",
          "evidence_status": "methodological_background",
          "role": "Bayesian calibration test-quantity sensitivity and undetected-error method boundary",
          "source_id": "calibration_test_quantity_sensitivity"
        },
        {
          "citation_key": "morris2019simulation",
          "evidence_status": "methodological_background",
          "role": "simulation estimand, performance measure, and Monte Carlo uncertainty method boundary",
          "source_id": "simulation_estimand_design"
        },
        {
          "citation_key": "parr2022active",
          "evidence_status": "theoretical_background",
          "role": "active-inference notation and free-energy decomposition",
          "source_id": "active_inference_book"
        },
        {
          "citation_key": "sailynoja2026posterior",
          "evidence_status": "methodological_background",
          "role": "conditional posterior calibration method and dataset-specific computation boundary",
          "source_id": "posterior_conditional_calibration"
        },
        {
          "citation_key": "sandvedsmith2026noself",
          "evidence_status": "source_anchor",
          "role": "primary formal target",
          "source_id": "no_self_evidence_preprint"
        },
        {
          "citation_key": "talts2018sbc",
          "evidence_status": "methodological_background",